{
  "agent_mode": false,
  "project": "PowerBI-AI-Starter.pbip",
  "output": "../output/SalesAnalytics/SalesAnalytics.pbip",
  "sources": ["sales.csv"],
  "business_goal": "Analyze revenue, profitability, customers, products and regional trends with YoY growth and drill-through details",
  "brand": {"company": "Northstar Retail", "primary_color": "#196A83"},
  "modeling": {"mode": "file"},
  "auto_open_powerbi": false,
  "visual_qa": false
}
